Content Acquisition Lead  US - BPO Management, https://www.indeed.jobs/career/JobDetail/Content-Acquisition-Lead-US-BPO-Management/11294,  Austin
Content Operations Associate, https://www.indeed.jobs/career/JobDetail/Content-Operations-Associate/10926,  Austin
Content Operations Associate - CH/AT, https://www.indeed.jobs/career/JobDetail/Content-Operations-Associate-CH-AT/10929,  Austin
Content Operations Associate - India, https://www.indeed.jobs/career/JobDetail/Content-Operations-Associate-India/10927,  Austin
Content Operations Manager - Americas, https://www.indeed.jobs/career/JobDetail/Content-Operations-Manager-Americas/11317,  Austin
Contracts Manager, https://www.indeed.jobs/career/JobDetail/Contracts-Manager/11386,  Austin
Core Services - Systems Engineer - Cloud, https://www.indeed.jobs/career/JobDetail/Core-Services-Systems-Engineer-Cloud/8390,  Austin
Core Services - Systems Engineer - Release Engineering, https://www.indeed.jobs/career/JobDetail/Core-Services-Systems-Engineer-Release-Engineering/10507,  Austin
Data Coordinator, https://www.indeed.jobs/career/JobDetail/Data-Coordinator/7225,  Austin
Data Engineer, https://www.indeed.jobs/career/JobDetail/Data-Engineer/6245,  Austin
Data Science Leader, https://www.indeed.jobs/career/JobDetail/Data-Science-Leader/8174,  Austin
Digital Marketing Manager, https://www.indeed.jobs/career/JobDetail/Digital-Marketing-Manager/9659,  Austin
Director of HR Analytics, https://www.indeed.jobs/career/JobDetail/Director-of-HR-Analytics/10232,  Austin
Director of Marketing  Prime, https://www.indeed.jobs/career/JobDetail/Director-of-Marketing-Prime/9928,  Austin
Director- New Product Commercialization, https://www.indeed.jobs/career/JobDetail/Director-New-Product-Commercialization/7651,  Austin
Director  Sales - Austin, https://www.indeed.jobs/career/JobDetail/Director-Sales/9192,  Downtown
Experimentation Lead - Data Science, https://www.indeed.jobs/career/JobDetail/Experimentation-Lead-Data-Science/11365,  Austin
Financial Modeling Associate  FP&A, https://www.indeed.jobs/career/JobDetail/Financial-Modeling-Associate-FP-A/11064,  Austin
Business Intelligence Analyst, https://www.indeed.jobs/career/JobDetail/Business-Intelligence-Analyst/10673,  Stamford
Business Intelligence Analyst, https://www.indeed.jobs/career/JobDetail/Business-Intelligence-Analyst/6248,  Stamford
Client Onboarding Strategist  Inside Sales, https://www.indeed.jobs/career/JobDetail/Client-Onboarding-Strategist-Inside-Sales/6146,  Stamford
Client Success Specialist  Ad Agencies, https://www.indeed.jobs/career/JobDetail/Client-Success-Specialist-Ad-Agencies/6255,  Stamford
Client Success Specialist  Shared, https://www.indeed.jobs/career/JobDetail/Client-Success-Specialist-Shared/10887,  Stamford
Java Manager - Remote - Remote, https://www.indeed.jobs/career/JobDetail/Java-Manager-Remote/10199,  US
National Account Manager - Staffing, https://www.indeed.jobs/career/JobDetail/National-Account-Manager-Staffing/11153,  Stamford
Senior Client Success Specialist  National Accounts, https://www.indeed.jobs/career/JobDetail/Senior-Client-Success-Specialist-National-Accounts/6258,  Stamford
Senior Java Engineer - Remote - Remote, https://www.indeed.jobs/career/JobDetail/Senior-Java-Engineer-Remote/10224,  US
Senior React/JS Engineer - Remote - Remote, https://www.indeed.jobs/career/JobDetail/Senior-React-JS-Engineer-Remote/10414,  US
Senior Ruby on Rails Engineer - Remote - Remote, https://www.indeed.jobs/career/JobDetail/Senior-Ruby-on-Rails-Engineer-Remote/9412,  US
Software Engineer Content Developer - Remote - Remote, https://www.indeed.jobs/career/JobDetail/Software-Engineer-Content-Developer-Remote/8171,  US
Client Onboarding Strategist  Inside Sales, https://www.indeed.jobs/career/JobDetail/Client-Onboarding-Strategist-Inside-Sales/6147,  Scottsdale
Java Manager - Remote - Remote, https://www.indeed.jobs/career/JobDetail/Java-Manager-Remote/10199,  US
Payroll Specialist, https://www.indeed.jobs/career/JobDetail/Payroll-Specialist/11356,  Scottsdale
Senior Java Engineer - Remote - Remote, https://www.indeed.jobs/career/JobDetail/Senior-Java-Engineer-Remote/10224,  US
Senior React/JS Engineer - Remote - Remote, https://www.indeed.jobs/career/JobDetail/Senior-React-JS-Engineer-Remote/10414,  US
Senior Ruby on Rails Engineer - Remote - Remote, https://www.indeed.jobs/career/JobDetail/Senior-Ruby-on-Rails-Engineer-Remote/9412,  US
Software Engineer Content Developer - Remote - Remote, https://www.indeed.jobs/career/JobDetail/Software-Engineer-Content-Developer-Remote/8171,  US
Advertising Sales Representative, https://www.indeed.jobs/career/JobDetail/Advertising-Sales-Representative/8002,  Sydney
Customer Support Associate, https://www.indeed.jobs/career/JobDetail/Customer-Support-Associate/7657,  Sydney
Customer Support Associate - Tagalog Speaking, https://www.indeed.jobs/career/JobDetail/Customer-Support-Associate-Tagalog-Speaking/8306,  Sydney
Customer Support Specialist- Shared Services, https://www.indeed.jobs/career/JobDetail/Customer-Support-Specialist-Shared-Services/10691,  Sydney
Director of Enterprise Sales, https://www.indeed.jobs/career/JobDetail/Director-of-Enterprise-Sales/9705,  Sydney
Marketing Director  Sydney, https://www.indeed.jobs/career/JobDetail/Marketing-Director-Sydney/10068,  Sydney
Outbound Customer Service Representative, https://www.indeed.jobs/career/JobDetail/Outbound-Customer-Service-Representative/8313,  Sydney
Outbound Customer Service Team Lead, https://www.indeed.jobs/career/JobDetail/Outbound-Customer-Service-Team-Lead/7903,  Sydney
Sales Representatives - Graduates, https://www.indeed.jobs/career/JobDetail/Sales-Representatives-Graduates/9186,  Sydney
Account Manager (m/w) B2B Neukundengewinnung in Düsseldorf, https://www.indeed.jobs/career/JobDetail/Account-Manager-m-w-B2B-Neukundengewinnung-in-D-sseldorf/7859,  Zürich
Account Manager, https://www.indeed.jobs/career/JobDetail/Account-Manager/6149,  Brussels
Accountmanager Binnendienst, https://www.indeed.jobs/career/JobDetail/Accountmanager-Binnendienst/7887,  Brussels
Director of Mid-Market Accounts (m/v), https://www.indeed.jobs/career/JobDetail/Director-of-Mid-Market-Accounts-m-v-/8294,  Brussels
Recruiter (m/v), https://www.indeed.jobs/career/JobDetail/Recruiter-m-v-/9498,  Brussels
Senior Client Success Specialist  National Accounts & Agencies (Brussels), https://www.indeed.jobs/career/JobDetail/Senior-Client-Success-Specialist-National-Accounts-Agencies-Brussels-/10090,  Brussels
Account Executive - Bilingual in English/Portuguese, https://www.indeed.jobs/career/JobDetail/Account-Executive-Bilingual-in-English-Portuguese/11394,  São Paulo
Account Executive  Inside Sales, https://www.indeed.jobs/career/JobDetail/Account-Executive-Inside-Sales/6133,  Toronto
Client Success Specialist  Bilingual in French and English, https://www.indeed.jobs/career/JobDetail/Client-Success-Specialist-Bilingual-in-French-and-English/10215,  Toronto
Country Marketing Associate  Canada, https://www.indeed.jobs/career/JobDetail/Country-Marketing-Associate-Canada/10640,  Toronto
Director  Inside Sales - Acquisition, https://www.indeed.jobs/career/JobDetail/Director-Inside-Sales-Acquisition/11201,  Toronto
Full Stack React/JS Engineer - Remote, https://www.indeed.jobs/career/JobDetail/Full-Stack-React-JS-Engineer-Remote/9920,  Toronto
Manager  Client Success Contact Centre (Bilingual English & French), https://www.indeed.jobs/career/JobDetail/Manager-Client-Success-Contact-Centre-Bilingual-English-French-/10025,  Toronto
Sales Support Specialist, https://www.indeed.jobs/career/JobDetail/Sales-Support-Specialist/10968,  Toronto
Account Manager, https://www.indeed.jobs/career/JobDetail/Account-Manager/6148,  Amsterdam
Account Specialist  Client Onboarding (Benelux Market - Dutch Speaker - Relocation to Dublin), https://www.indeed.jobs/career/JobDetail/Account-Specialist-Client-Onboarding-Benelux-Market-Dutch-Speaker-Relocation-to-Dublin-/9609,  Amsterdam
Accountmanager Binnendienst, https://www.indeed.jobs/career/JobDetail/Accountmanager-Binnendienst/6150,  Amsterdam
Alliances Manager (Dutch), https://www.indeed.jobs/career/JobDetail/Alliances-Manager-Dutch-/10236,  Amsterdam
Client Success Manager, https://www.indeed.jobs/career/JobDetail/Client-Success-Manager/10263,  Amsterdam
Client Success Specialist  Inside Sales, https://www.indeed.jobs/career/JobDetail/Client-Success-Specialist-Inside-Sales/10947,  Amsterdam
Director of Marketing  Benelux, https://www.indeed.jobs/career/JobDetail/Director-of-Marketing-Benelux/11359,  Amsterdam
HR Coordinator, https://www.indeed.jobs/career/JobDetail/HR-Coordinator/10489,  Amsterdam
IT Support Specialist - Amsterdam, https://www.indeed.jobs/career/JobDetail/IT-Support-Specialist-Amsterdam/9090,  Amsterdam
New Product Sales Specialist, https://www.indeed.jobs/career/JobDetail/New-Product-Sales-Specialist/8602,  Amsterdam
Recruiter, https://www.indeed.jobs/career/JobDetail/Recruiter/9177,  Amsterdam
Sales Support Analyst, https://www.indeed.jobs/career/JobDetail/Sales-Support-Analyst/8509,  Amsterdam
Senior Client Success Specialist, https://www.indeed.jobs/career/JobDetail/Senior-Client-Success-Specialist/10524,  Amsterdam
Senior Client Success Specialist Agencies, https://www.indeed.jobs/career/JobDetail/Senior-Client-Success-Specialist-Agencies/10950,  Amsterdam
Senior UX Designer - Resume Search, https://www.indeed.jobs/career/JobDetail/Senior-UX-Designer-Resume-Search/10796,  Seattle
Senior Voice of Customer Specialist, https://www.indeed.jobs/career/JobDetail/Senior-Voice-of-Customer-Specialist/10850,  Seattle
Software Engineer Content Developer - Remote - Remote, https://www.indeed.jobs/career/JobDetail/Software-Engineer-Content-Developer-Remote/8171,  US
Software Engineer I, https://www.indeed.jobs/career/JobDetail/Software-Engineer-I/11319,  Seattle
Software Engineer  Site Reliability Engineer, https://www.indeed.jobs/career/JobDetail/Software-Engineer-Site-Reliability-Engineer/6620,  Seattle
Software Engineering Manager, https://www.indeed.jobs/career/JobDetail/Software-Engineering-Manager/6265,  Seattle
Sr. UX Designer, https://www.indeed.jobs/career/JobDetail/Sr-UX-Designer/9757,  Seattle
Technical Fellow, https://www.indeed.jobs/career/JobDetail/Technical-Fellow/8004,  Seattle
Technical Product Manager, https://www.indeed.jobs/career/JobDetail/Technical-Product-Manager/8679,  Seattle
Technical Recruiter, https://www.indeed.jobs/career/JobDetail/Technical-Recruiter/6999,  Seattle
Technical Sourcer, https://www.indeed.jobs/career/JobDetail/Technical-Sourcer/6987,  Seattle
UX Designer - Seattle, https://www.indeed.jobs/career/JobDetail/UX-Designer-Seattle/10216,  Seattle
UX Designer  Employer Products, https://www.indeed.jobs/career/JobDetail/UX-Designer-Employer-Products/7896,  Seattle
Client Success Specialist  Dedicated (Dutch), https://www.indeed.jobs/career/JobDetail/Client-Success-Specialist-Dedicated-Dutch-/10946,  Dublin
Client Success Specialist  Dedicated (German), https://www.indeed.jobs/career/JobDetail/Client-Success-Specialist-Dedicated-German-/10772,  Dublin
Client Success Specialist  Dedicated (UK/I), https://www.indeed.jobs/career/JobDetail/Client-Success-Specialist-Dedicated-UK-I-/10720,  Dublin
Client Success Specialist  Shared (German), https://www.indeed.jobs/career/JobDetail/Client-Success-Specialist-Shared-German-/10753,  Dublin
Client Success Specialist  Shared (Spanish and Portuguese), https://www.indeed.jobs/career/JobDetail/Client-Success-Specialist-Shared-Spanish-and-Portuguese-/11308,  Dublin
Client Success Specialist  Shared (UK/I), https://www.indeed.jobs/career/JobDetail/Client-Success-Specialist-Shared-UK-I-/10098,  Dublin
Client Success Specialist  Shared Support - Dutch/Flemish market, https://www.indeed.jobs/career/JobDetail/Client-Success-Specialist-Shared-Support-Dutch-Flemish-market/9945,  Dublin
Content Acquisition Associate  Polish (11 month FTC), https://www.indeed.jobs/career/JobDetail/Content-Acquisition-Associate-Polish-11-month-FTC-/10251,  Dublin
Content Acquisition Associate  Swedish (11 month FTC), https://www.indeed.jobs/career/JobDetail/Content-Acquisition-Associate-Swedish-11-month-FTC-/10938,  Dublin
Content Acquisition Associate  UK/I (11 month FTC), https://www.indeed.jobs/career/JobDetail/Content-Acquisition-Associate-UK-I-11-month-FTC-/7984,  Dublin
Content Acquisition Lead (Dutch) - BPO management, https://www.indeed.jobs/career/JobDetail/Content-Acquisition-Lead-Dutch-BPO-management/8985,  Dublin
Content Localization Specialist (Dutch), https://www.indeed.jobs/career/JobDetail/Content-Localization-Specialist-Dutch-/10550,  Dublin
Content Localization Specialist (French), https://www.indeed.jobs/career/JobDetail/Content-Localization-Specialist-French-/10551,  Dublin
Content Localization Specialist (German), https://www.indeed.jobs/career/JobDetail/Content-Localization-Specialist-German-/10549,  Dublin
Director of Sales (French Market), https://www.indeed.jobs/career/JobDetail/Director-of-Sales-French-Market-/10762,  Dublin
Event Services Coordinator, https://www.indeed.jobs/career/JobDetail/Event-Services-Coordinator/10812,  Dublin
International Contracts Analyst, https://www.indeed.jobs/career/JobDetail/International-Contracts-Analyst/9390,  Dublin
International Search Quality Operations Analyst, https://www.indeed.jobs/career/JobDetail/International-Search-Quality-Operations-Analyst/9316,  Dublin
IT Support Manager  EMEA, https://www.indeed.jobs/career/JobDetail/IT-Support-Manager-EMEA/10526,  Dublin
IT Support Specialist, https://www.indeed.jobs/career/JobDetail/IT-Support-Specialist/9338,  Dublin
IT Support Specialist / ITサポート, https://www.indeed.jobs/career/JobDetail/IT-Support-Specialist-IT-/8885,  Tokyo Sales/CS
Japan Copywriter, https://www.indeed.jobs/career/JobDetail/Japan-Copywriter/8041,  Tokyo Tech Meguro
Learning Experience Facilitator, https://www.indeed.jobs/career/JobDetail/Learning-Experience-Facilitator/10013,  Tokyo Tech Ebisu
Manager  Global Infrastructure (APAC), https://www.indeed.jobs/career/JobDetail/Manager-Global-Infrastructure-APAC-/9314,  Tokyo Tech Ebisu
Manager  Product Science, https://www.indeed.jobs/career/JobDetail/Manager-Product-Science/7640,  Tokyo Tech Ebisu
Manager  Site Reliability Engineering, https://www.indeed.jobs/career/JobDetail/Manager-Site-Reliability-Engineering/6407,  Tokyo Tech Ebisu
Manager  UX Design, https://www.indeed.jobs/career/JobDetail/Manager-UX-Design/6363,  Tokyo Tech Ebisu
Marketing Research/ マーケティングリサーチ, https://www.indeed.jobs/career/JobDetail/Marketing-Research-/3121,  Tokyo Sales/CS
MySQL Database Administrator (DBA) / データベースアドミニストレータ, https://www.indeed.jobs/career/JobDetail/MySQL-Database-Administrator-DBA-/6204,  Tokyo Tech Ebisu
Physical Security Engineer (APAC), https://www.indeed.jobs/career/JobDetail/Physical-Security-Engineer-APAC-/9369,  Tokyo Tech Ebisu
Program Manager, https://www.indeed.jobs/career/JobDetail/Program-Manager/6816,  Tokyo Tech Ebisu
Quality Assurance Engineer, https://www.indeed.jobs/career/JobDetail/Quality-Assurance-Engineer/11412,  Tokyo Tech Ebisu
Quality Assurance Engineering Manager, https://www.indeed.jobs/career/JobDetail/Quality-Assurance-Engineering-Manager/7606,  Tokyo Tech Ebisu
Sales Strategy Manager (Bilingual), https://www.indeed.jobs/career/JobDetail/Sales-Strategy-Manager-Bilingual-/8412,  Tokyo Sales/CS
Sales Support Specialist, https://www.indeed.jobs/career/JobDetail/Sales-Support-Specialist/11110,  Tokyo Sales/CS
Senior Manager  Data Science, https://www.indeed.jobs/career/JobDetail/Senior-Manager-Data-Science/4427,  Tokyo Tech Ebisu
Senior Manager  Quality Assurance Engineering, https://www.indeed.jobs/career/JobDetail/Senior-Manager-Quality-Assurance-Engineering/6528,  Tokyo Tech Ebisu
Senior Software Engineer - Job Recommendations, https://www.indeed.jobs/career/JobDetail/Senior-Software-Engineer-Job-Recommendations/9263,  Tokyo Tech Ebisu
Senior Software Engineer - Search, https://www.indeed.jobs/career/JobDetail/Senior-Software-Engineer-Search/5351,  Tokyo Tech Ebisu
Senior System Engineer, https://www.indeed.jobs/career/JobDetail/Senior-System-Engineer/6819,  Tokyo Tech Ebisu
Software Engineer - Open Source, https://www.indeed.jobs/career/JobDetail/Software-Engineer-Open-Source/10102,  San Francisco
Software Engineer Content Developer - Remote - Remote, https://www.indeed.jobs/career/JobDetail/Software-Engineer-Content-Developer-Remote/8171,  US
Software Engineer  Site Reliability Engineer, https://www.indeed.jobs/career/JobDetail/Software-Engineer-Site-Reliability-Engineer/6619,  San Francisco
Sr. UX Designer  Native Apps, https://www.indeed.jobs/career/JobDetail/Sr-UX-Designer-Native-Apps/8870,  San Francisco
Technical Product Manager, https://www.indeed.jobs/career/JobDetail/Technical-Product-Manager/8683,  San Francisco
Technical Recruiter, https://www.indeed.jobs/career/JobDetail/Technical-Recruiter/10047,  San Francisco
Technical Sourcer, https://www.indeed.jobs/career/JobDetail/Technical-Sourcer/6986,  San Francisco
Technical Writer, https://www.indeed.jobs/career/JobDetail/Technical-Writer/7081,  San Francisco
Front End Software Engineer, https://www.indeed.jobs/career/JobDetail/Front-End-Software-Engineer/7972,  Austin
Global Mobility Specialist, https://www.indeed.jobs/career/JobDetail/Global-Mobility-Specialist/11326,  Austin
Head of Global Program Management, https://www.indeed.jobs/career/JobDetail/Head-of-Global-Program-Management/9443,  Austin
HR Generalist, https://www.indeed.jobs/career/JobDetail/HR-Generalist/10461,  Austin
HRIS Analyst, https://www.indeed.jobs/career/JobDetail/HRIS-Analyst/10226,  Austin
Instructional Designer, https://www.indeed.jobs/career/JobDetail/Instructional-Designer/9796,  Austin
International Business Operations Associate - Sales/Marketing Collateral - Austin, https://www.indeed.jobs/career/JobDetail/International-Business-Operations-Associate-Sales-Marketing-Collateral/11044,  Downtown
International Operations Analyst - Dutch-Speaking Markets, https://www.indeed.jobs/career/JobDetail/International-Operations-Analyst-Dutch-Speaking-Markets/6863,  Austin
International Operations Analyst - German-Speaking Markets, https://www.indeed.jobs/career/JobDetail/International-Operations-Analyst-German-Speaking-Markets/816,  Austin
International Operations Analyst - Poland, https://www.indeed.jobs/career/JobDetail/International-Operations-Analyst-Poland/4026,  Austin
International Operations Analyst - South Africa, https://www.indeed.jobs/career/JobDetail/International-Operations-Analyst-South-Africa/10650,  Austin
International Operations Analyst - Spain, https://www.indeed.jobs/career/JobDetail/International-Operations-Analyst-Spain/10029,  Austin
International Operations Analyst - Ukraine and Russia, https://www.indeed.jobs/career/JobDetail/International-Operations-Analyst-Ukraine-and-Russia/5589,  Austin
International Operations Analyst- Australia/New Zealand, https://www.indeed.jobs/career/JobDetail/International-Operations-Analyst-Australia-New-Zealand/9719,  Austin
International Operations Analyst- Israel and the Middle East (Hebrew), https://www.indeed.jobs/career/JobDetail/International-Operations-Analyst-Israel-and-the-Middle-East-Hebrew-/9562,  Austin
International Operations Analyst- Middle East (Arabic), https://www.indeed.jobs/career/JobDetail/International-Operations-Analyst-Middle-East-Arabic-/9584,  Austin
International Operations Manager- France, https://www.indeed.jobs/career/JobDetail/International-Operations-Manager-France/5561,  Austin
International Search Quality Operation Analyst - Nordic  African and European Markets, https://www.indeed.jobs/career/JobDetail/International-Search-Quality-Operation-Analyst-Nordic-African-and-European-Markets/9322,  Austin
International Search Quality Operations Analyst - Australian Market, https://www.indeed.jobs/career/JobDetail/International-Search-Quality-Operations-Analyst-Australian-Market/9830,  Austin
International Search Quality Operations Analyst - Portuguese, https://www.indeed.jobs/career/JobDetail/International-Search-Quality-Operations-Analyst-Portuguese/11003,  Austin
Software Engineer  Site Reliability Engineering (SRE) / サイト信頼性エンジニア, https://www.indeed.jobs/career/JobDetail/Software-Engineer-Site-Reliability-Engineering-SRE-/4591,  Tokyo Tech Ebisu
Sourcing Manager  Talent Attraction, https://www.indeed.jobs/career/JobDetail/Sourcing-Manager-Talent-Attraction/8415,  Tokyo Sales/CS
Systems Engineer  Site Reliability Engineering (SRE) / サイト信頼性エンジニア, https://www.indeed.jobs/career/JobDetail/Systems-Engineer-Site-Reliability-Engineering-SRE-/6408,  Tokyo Tech Ebisu
Technical Recruiter, https://www.indeed.jobs/career/JobDetail/Technical-Recruiter/7002,  Tokyo Tech Ebisu
Technical Sourcer, https://www.indeed.jobs/career/JobDetail/Technical-Sourcer/9848,  Tokyo Tech Ebisu
Technical Writer / テクニカルライター, https://www.indeed.jobs/career/JobDetail/Technical-Writer-/6839,  Tokyo Tech Ebisu
User Experience (UX) Designer, https://www.indeed.jobs/career/JobDetail/User-Experience-UX-Designer/5858,  Tokyo Tech Ebisu
User Experience (UX) Researcher, https://www.indeed.jobs/career/JobDetail/User-Experience-UX-Researcher/5456,  Tokyo Tech Ebisu
営業ディレクター (Director of Sales), https://www.indeed.jobs/career/JobDetail/-Director-of-Sales-/4770,  Tokyo Sales/CS
法人営業（Web広告提案営業）, https://www.indeed.jobs/career/JobDetail/-Web-/10564,  Tokyo Sales/CS
法人営業（インサイドセールス / 内勤営業）, https://www.indeed.jobs/career/JobDetail/-/10562,  Tokyo Sales/CS
Lead Sales Strategist, https://www.indeed.jobs/career/JobDetail/Lead-Sales-Strategist/9410,  Dublin
Manager  Regional Sales Support, https://www.indeed.jobs/career/JobDetail/Manager-Regional-Sales-Support/10797,  Dublin
Partner Manager, https://www.indeed.jobs/career/JobDetail/Partner-Manager/10261,  Dublin
Program Manager, https://www.indeed.jobs/career/JobDetail/Program-Manager/10983,  Dublin
Project Manager  Sales Support, https://www.indeed.jobs/career/JobDetail/Project-Manager-Sales-Support/10701,  Dublin
Real Estate IT Project Manager, https://www.indeed.jobs/career/JobDetail/Real-Estate-IT-Project-Manager/10434,  Dublin
Recruiter, https://www.indeed.jobs/career/JobDetail/Recruiter/7010,  Dublin
Sales Executive, https://www.indeed.jobs/career/JobDetail/Sales-Executive/6157,  Dublin
Sales Support Specialist (German), https://www.indeed.jobs/career/JobDetail/Sales-Support-Specialist-German-/10770,  Dublin
Sales Support Specialist  Dutch, https://www.indeed.jobs/career/JobDetail/Sales-Support-Specialist-Dutch/10214,  Dublin
Sales Support Specialist  UK, https://www.indeed.jobs/career/JobDetail/Sales-Support-Specialist-UK/10140,  Dublin
Sales Training Manager- Enterprise Sales, https://www.indeed.jobs/career/JobDetail/Sales-Training-Manager-Enterprise-Sales/8494,  Dublin
Sales Training Manager- Inside Sales, https://www.indeed.jobs/career/JobDetail/Sales-Training-Manager-Inside-Sales/6337,  Dublin
Senior Data Governance Analyst, https://www.indeed.jobs/career/JobDetail/Senior-Data-Governance-Analyst/9376,  Dublin
Senior Manager  International Strategy & Operations, https://www.indeed.jobs/career/JobDetail/Senior-Manager-International-Strategy-Operations/9942,  Dublin
Senior Sales Analyst  Global Sales Strategy, https://www.indeed.jobs/career/JobDetail/Senior-Sales-Analyst-Global-Sales-Strategy/10923,  Dublin
Site Reliability Engineering Manager, https://www.indeed.jobs/career/JobDetail/Site-Reliability-Engineering-Manager/5698,  Dublin
Sourcing Manager  Talent Attraction, https://www.indeed.jobs/career/JobDetail/Sourcing-Manager-Talent-Attraction/8414,  Dublin
Strategy and Operations Associate, https://www.indeed.jobs/career/JobDetail/Strategy-and-Operations-Associate/10100,  Dublin
Team Lead  International Search Quality, https://www.indeed.jobs/career/JobDetail/Team-Lead-International-Search-Quality/11346,  Dublin
International Taxonomy Analyst - German, https://www.indeed.jobs/career/JobDetail/International-Taxonomy-Analyst-German/7877,  Austin
International Taxonomy Analyst - India, https://www.indeed.jobs/career/JobDetail/International-Taxonomy-Analyst-India/10386,  Austin
International Taxonomy Analyst - Japan, https://www.indeed.jobs/career/JobDetail/International-Taxonomy-Analyst-Japan/9277,  Austin
IT AV Specialist, https://www.indeed.jobs/career/JobDetail/IT-AV-Specialist/10843,  Austin
IT Compliance Analyst, https://www.indeed.jobs/career/JobDetail/IT-Compliance-Analyst/9223,  Austin
Java Manager - Remote - Remote, https://www.indeed.jobs/career/JobDetail/Java-Manager-Remote/10199,  US
Legal Analyst - Immigration & HR, https://www.indeed.jobs/career/JobDetail/Legal-Analyst-Immigration-HR/11238,  Austin
Legal Analyst  Compliance, https://www.indeed.jobs/career/JobDetail/Legal-Analyst-Compliance/11062,  Austin
Linux Systems Engineer - Production Operations, https://www.indeed.jobs/career/JobDetail/Linux-Systems-Engineer-Production-Operations/9315,  Austin
Manager - Data Governance, https://www.indeed.jobs/career/JobDetail/Manager-Data-Governance/4548,  Austin
Manager  Client Success - Bilingual in Spanish/English - Austin, https://www.indeed.jobs/career/JobDetail/Manager-Client-Success-Bilingual-in-Spanish-English/11278,  Downtown
Manager  Global Indirect Procurement, https://www.indeed.jobs/career/JobDetail/Manager-Global-Indirect-Procurement/10802,  Austin
Marketing Content Operations Associate - Austin, https://www.indeed.jobs/career/JobDetail/Marketing-Content-Operations-Associate/10453,  Downtown
Marketing Manager  International Lifecycle, https://www.indeed.jobs/career/JobDetail/Marketing-Manager-International-Lifecycle/10811,  Austin
