Account Executive  Acquisition (Staffing), https://www.indeed.jobs/career/JobDetail/Account-Executive-Acquisition-Staffing-/10893,  New York City
Account Manager  Franchise Sales, https://www.indeed.jobs/career/JobDetail/Account-Manager-Franchise-Sales/6137,  New York City
Analytical Lead, https://www.indeed.jobs/career/JobDetail/Analytical-Lead/10495,  New York City
Associate Program Manager  CS/Sales, https://www.indeed.jobs/career/JobDetail/Associate-Program-Manager-CS-Sales/9828,  New York City
Business Data Analyst, https://www.indeed.jobs/career/JobDetail/Business-Data-Analyst/9957,  New York City
Business Intelligence Developer, https://www.indeed.jobs/career/JobDetail/Business-Intelligence-Developer/6247,  New York City
Business Intelligence Manager, https://www.indeed.jobs/career/JobDetail/Business-Intelligence-Manager/6222,  New York City
Client Success Specialist, https://www.indeed.jobs/career/JobDetail/Client-Success-Specialist/6252,  New York City
Country Marketing Associate, https://www.indeed.jobs/career/JobDetail/Country-Marketing-Associate/11277,  New York City
Director  Capital Budgeting - Real Estate, https://www.indeed.jobs/career/JobDetail/Director-Capital-Budgeting-Real-Estate/10915,  New York City
Director  Global Benefits, https://www.indeed.jobs/career/JobDetail/Director-Global-Benefits/11264,  New York City
Diversity and Inclusion Manager, https://www.indeed.jobs/career/JobDetail/Diversity-and-Inclusion-Manager/11113,  New York City
FP&A Reporting Manager, https://www.indeed.jobs/career/JobDetail/FP-A-Reporting-Manager/8860,  New York City
Inside Sales Account Executive - Growth, https://www.indeed.jobs/career/JobDetail/Inside-Sales-Account-Executive-Growth/6136,  New York City
Inside Sales Account Executive- Acquisition, https://www.indeed.jobs/career/JobDetail/Inside-Sales-Account-Executive-Acquisition/6135,  New York City
IT AV Specialist, https://www.indeed.jobs/career/JobDetail/IT-AV-Specialist/8277,  New York City
IT Shoretel Specialist, https://www.indeed.jobs/career/JobDetail/IT-Shoretel-Specialist/8276,  New York City
IT Systems Administrator - New York, https://www.indeed.jobs/career/JobDetail/IT-Systems-Administrator-New-York/9129,  New York City
Java Manager - Remote - Remote, https://www.indeed.jobs/career/JobDetail/Java-Manager-Remote/10199,  US
Manager  Sales Analysis, https://www.indeed.jobs/career/JobDetail/Manager-Sales-Analysis/10407,  New York City
Account Executive  Acquisition (Inside Sales) - Austin, https://www.indeed.jobs/career/JobDetail/Account-Executive-Acquisition-Inside-Sales-/6141,  Downtown
Account Executive  Bilingual Spanish - Austin, https://www.indeed.jobs/career/JobDetail/Account-Executive-Bilingual-Spanish/10000,  Downtown
Account Executive  Growth (Inside Sales) - Austin, https://www.indeed.jobs/career/JobDetail/Account-Executive-Growth-Inside-Sales-/6142,  Downtown
Administrative Coordinator - Search Quality, https://www.indeed.jobs/career/JobDetail/Administrative-Coordinator-Search-Quality/9829,  Austin
Aggregation Data Maintenance Associate, https://www.indeed.jobs/career/JobDetail/Aggregation-Data-Maintenance-Associate/8209,  Austin
Associate Marketing Manager  Indeed Experience (Recruiter), https://www.indeed.jobs/career/JobDetail/Associate-Marketing-Manager-Indeed-Experience-Recruiter-/11049,  Austin
Associate Marketing Manager  International Lifecycle, https://www.indeed.jobs/career/JobDetail/Associate-Marketing-Manager-International-Lifecycle/11050,  Austin
Associate Program Manager  Business Automation, https://www.indeed.jobs/career/JobDetail/Associate-Program-Manager-Business-Automation/9738,  Austin
Associate Program Manager  Business Automation, https://www.indeed.jobs/career/JobDetail/Associate-Program-Manager-Business-Automation/10582,  Austin
Associate Program Manager  Business Intelligence, https://www.indeed.jobs/career/JobDetail/Associate-Program-Manager-Business-Intelligence/10177,  Austin
Associate Program Manager  Engineering Capabilities, https://www.indeed.jobs/career/JobDetail/Associate-Program-Manager-Engineering-Capabilities/11169,  Austin
Bot Detection Program Manager, https://www.indeed.jobs/career/JobDetail/Bot-Detection-Program-Manager/10150,  Austin
Brand Strategy Director, https://www.indeed.jobs/career/JobDetail/Brand-Strategy-Director/5652,  Austin
Business Analyst, https://www.indeed.jobs/career/JobDetail/Business-Analyst/10969,  Austin
Business Intelligence Analyst, https://www.indeed.jobs/career/JobDetail/Business-Intelligence-Analyst/6173,  Austin
Business Intelligence Analyst - Assessments, https://www.indeed.jobs/career/JobDetail/Business-Intelligence-Analyst-Assessments/7226,  Austin
Business Intelligence Developer, https://www.indeed.jobs/career/JobDetail/Business-Intelligence-Developer/6246,  Austin
Business Intelligence Manager, https://www.indeed.jobs/career/JobDetail/Business-Intelligence-Manager/9198,  Austin
Business Operations Marketing Producer - Austin, https://www.indeed.jobs/career/JobDetail/Business-Operations-Marketing-Producer/10810,  Downtown
Buyer II, https://www.indeed.jobs/career/JobDetail/Buyer-II/11118,  Austin
Buyer, https://www.indeed.jobs/career/JobDetail/Buyer/11076,  Hyderabad
Data Science Manager, https://www.indeed.jobs/career/JobDetail/Data-Science-Manager/9859,  Hyderabad
Engineering Manager, https://www.indeed.jobs/career/JobDetail/Engineering-Manager/6455,  Hyderabad
Engineering Manager  Site Reliability Engineering, https://www.indeed.jobs/career/JobDetail/Engineering-Manager-Site-Reliability-Engineering/4759,  Hyderabad
HR Coordinator, https://www.indeed.jobs/career/JobDetail/HR-Coordinator/7706,  Hyderabad
Manager  Quality Assurance Engineering, https://www.indeed.jobs/career/JobDetail/Manager-Quality-Assurance-Engineering/11218,  Hyderabad
Product Manager, https://www.indeed.jobs/career/JobDetail/Product-Manager/7665,  Hyderabad
Product Manager, https://www.indeed.jobs/career/JobDetail/Product-Manager/7590,  Hyderabad
Senior Software Engineer, https://www.indeed.jobs/career/JobDetail/Senior-Software-Engineer/6518,  Hyderabad
Site Reliability Engineer, https://www.indeed.jobs/career/JobDetail/Site-Reliability-Engineer/4749,  Hyderabad
Systems Engineer  Site Reliability Engineering, https://www.indeed.jobs/career/JobDetail/Systems-Engineer-Site-Reliability-Engineering/4760,  Hyderabad
Technical Program Manager, https://www.indeed.jobs/career/JobDetail/Technical-Program-Manager/6563,  Hyderabad
Account Executive - Schweizer Markt (m/w), https://www.indeed.jobs/career/JobDetail/Account-Executive-Schweizer-Markt-m-w-/5114,  Düsseldorf
Account Manager (m/w) für Bestandskunden B2B, https://www.indeed.jobs/career/JobDetail/Account-Manager-m-w-f-r-Bestandskunden-B2B/9164,  Düsseldorf
Client Success Manager  Agencies (m/w), https://www.indeed.jobs/career/JobDetail/Client-Success-Manager-Agencies-m-w-/10518,  Düsseldorf
Content Marketing Associate DACH (m/w), https://www.indeed.jobs/career/JobDetail/Content-Marketing-Associate-DACH-m-w-/8375,  Düsseldorf
Director (m/w) of Mid-Market Accounts - (KMU), https://www.indeed.jobs/career/JobDetail/Director-m-w-of-Mid-Market-Accounts-KMU-/10553,  Düsseldorf
Director (m/w) of Mid-Market Accounts - Deutschschweiz (KMU), https://www.indeed.jobs/career/JobDetail/Director-m-w-of-Mid-Market-Accounts-Deutschschweiz-KMU-/10554,  Düsseldorf
IT Support Specialist (M/W), https://www.indeed.jobs/career/JobDetail/IT-Support-Specialist-M-W-/10303,  Düsseldorf
Mitarbeiter Vertrieb (m/w), https://www.indeed.jobs/career/JobDetail/Mitarbeiter-Vertrieb-m-w-/9499,  Düsseldorf
National Account Manager (m/w), https://www.indeed.jobs/career/JobDetail/National-Account-Manager-m-w-/6152,  Düsseldorf
Sales Support Analyst (m/w), https://www.indeed.jobs/career/JobDetail/Sales-Support-Analyst-m-w-/8510,  Düsseldorf
Sales Trainer (m/w), https://www.indeed.jobs/career/JobDetail/Sales-Trainer-m-w-/10985,  Düsseldorf
Senior Client Success Manager - National Accounts / Ad Agency (m/w), https://www.indeed.jobs/career/JobDetail/Senior-Client-Success-Manager-National-Accounts-Ad-Agency-m-w-/9467,  Düsseldorf
Senior Sales Analyst (m/w), https://www.indeed.jobs/career/JobDetail/Senior-Sales-Analyst-m-w-/8662,  Düsseldorf
Sourcer (m/w), https://www.indeed.jobs/career/JobDetail/Sourcer-m-w-/6979,  Düsseldorf
Vertriebsinnendienst B2B - Absolvent (m/w), https://www.indeed.jobs/career/JobDetail/Vertriebsinnendienst-B2B-Absolvent-m-w-/9163,  Düsseldorf
Vertriebsinnendienst Mitarbeiter (m/w) für Neukunden B2B, https://www.indeed.jobs/career/JobDetail/Vertriebsinnendienst-Mitarbeiter-m-w-f-r-Neukunden-B2B/6154,  Düsseldorf
Vertriebsinnendienst Mitarbeiter (m/w) für Neukunden B2B - Standort Dublin, https://www.indeed.jobs/career/JobDetail/Vertriebsinnendienst-Mitarbeiter-m-w-f-r-Neukunden-B2B-Standort-Dublin/9395,  Düsseldorf
Director of Marketing  France (H/F), https://www.indeed.jobs/career/JobDetail/Director-of-Marketing-France-H-F-/11357,  Paris
Responsable Grands Comptes, https://www.indeed.jobs/career/JobDetail/Responsable-Grands-Comptes/746,  Paris
Senior Client Success Specialist  NA/Agencies (French), https://www.indeed.jobs/career/JobDetail/Senior-Client-Success-Specialist-NA-Agencies-French-/7525,  Paris
Strategic Client Manager - French Market - H/F, https://www.indeed.jobs/career/JobDetail/Strategic-Client-Manager-French-Market-H-F/6159,  Paris
Technicien Support Informatique (H/F), https://www.indeed.jobs/career/JobDetail/Technicien-Support-Informatique-H-F-/9516,  Paris
Account Executive - (Italian Market), https://www.indeed.jobs/career/JobDetail/Account-Executive-Italian-Market-/10157,  Dublin
Account Executive - French Market, https://www.indeed.jobs/career/JobDetail/Account-Executive-French-Market/6158,  Dublin
Account Executive - French Speaker - Relocating to Dublin, https://www.indeed.jobs/career/JobDetail/Account-Executive-French-Speaker-Relocating-to-Dublin/6002,  Dublin
Account Executive - German market, https://www.indeed.jobs/career/JobDetail/Account-Executive-German-market/6155,  Dublin
Account Executive (Benelux market) - Dutch speaker, https://www.indeed.jobs/career/JobDetail/Account-Executive-Benelux-market-Dutch-speaker/6151,  Dublin
Account Executive (Nordic Market - Swedish Speaker), https://www.indeed.jobs/career/JobDetail/Account-Executive-Nordic-Market-Swedish-Speaker-/7861,  Dublin
Account Executive (Spanish Market), https://www.indeed.jobs/career/JobDetail/Account-Executive-Spanish-Market-/11256,  Dublin
Account Executive  Growth, https://www.indeed.jobs/career/JobDetail/Account-Executive-Growth/10023,  Dublin
Account Executive  Media Agencies (Swedish Speaker), https://www.indeed.jobs/career/JobDetail/Account-Executive-Media-Agencies-Swedish-Speaker-/9392,  Dublin
Account Manager - French Speaker, https://www.indeed.jobs/career/JobDetail/Account-Manager-French-Speaker/7634,  Dublin
Account Specialist  Client Onboarding (Benelux), https://www.indeed.jobs/career/JobDetail/Account-Specialist-Client-Onboarding-Benelux-/9621,  Dublin
Account Strategist  Client Onboarding (DACH), https://www.indeed.jobs/career/JobDetail/Account-Strategist-Client-Onboarding-DACH-/9915,  Dublin
Account Strategist  Client Onboarding (Dutch), https://www.indeed.jobs/career/JobDetail/Account-Strategist-Client-Onboarding-Dutch-/9916,  Dublin
Accounts Receivable Specialist (German Speaking), https://www.indeed.jobs/career/JobDetail/Accounts-Receivable-Specialist-German-Speaking-/11247,  Dublin
Alliances Associate, https://www.indeed.jobs/career/JobDetail/Alliances-Associate/10652,  Dublin
Business Analyst, https://www.indeed.jobs/career/JobDetail/Business-Analyst/10704,  Dublin
Business Analyst (Process), https://www.indeed.jobs/career/JobDetail/Business-Analyst-Process-/9382,  Dublin
Business Intelligence Analyst, https://www.indeed.jobs/career/JobDetail/Business-Intelligence-Analyst/6171,  Dublin
Client Success Manager  Agency (French), https://www.indeed.jobs/career/JobDetail/Client-Success-Manager-Agency-French-/11250,  Dublin
Client Success Specialist  Agency (French), https://www.indeed.jobs/career/JobDetail/Client-Success-Specialist-Agency-French-/10707,  Dublin
Client Success Specialist, https://www.indeed.jobs/career/JobDetail/Client-Success-Specialist/6160,  San Mateo
Client Success Specialist  Ad Agencies, https://www.indeed.jobs/career/JobDetail/Client-Success-Specialist-Ad-Agencies/9937,  San Mateo
Client Success Specialist  Shared, https://www.indeed.jobs/career/JobDetail/Client-Success-Specialist-Shared/11263,  San Mateo
Java Manager - Remote - Remote, https://www.indeed.jobs/career/JobDetail/Java-Manager-Remote/10199,  US
Office Manager, https://www.indeed.jobs/career/JobDetail/Office-Manager/9459,  San Mateo
Senior Java Engineer - Remote - Remote, https://www.indeed.jobs/career/JobDetail/Senior-Java-Engineer-Remote/10224,  US
Senior React/JS Engineer - Remote - Remote, https://www.indeed.jobs/career/JobDetail/Senior-React-JS-Engineer-Remote/10414,  US
Senior Ruby on Rails Engineer - Remote - Remote, https://www.indeed.jobs/career/JobDetail/Senior-Ruby-on-Rails-Engineer-Remote/9412,  US
Software Engineer Content Developer - Remote - Remote, https://www.indeed.jobs/career/JobDetail/Software-Engineer-Content-Developer-Remote/8171,  US
Associate Program Manager  UX, https://www.indeed.jobs/career/JobDetail/Associate-Program-Manager-UX/9365,  Seattle
Data Engineer, https://www.indeed.jobs/career/JobDetail/Data-Engineer/11230,  Seattle
Data Scientist, https://www.indeed.jobs/career/JobDetail/Data-Scientist/6269,  Seattle
Design Technologist, https://www.indeed.jobs/career/JobDetail/Design-Technologist/8873,  Seattle
Front End Software Engineer, https://www.indeed.jobs/career/JobDetail/Front-End-Software-Engineer/7973,  Seattle
Java Manager - Remote - Remote, https://www.indeed.jobs/career/JobDetail/Java-Manager-Remote/10199,  US
National Account Manager - Staffing (Seattle), https://www.indeed.jobs/career/JobDetail/National-Account-Manager-Staffing-Seattle-/11162,  Seattle
Office Manager, https://www.indeed.jobs/career/JobDetail/Office-Manager/8077,  Seattle
Product Director - ATS, https://www.indeed.jobs/career/JobDetail/Product-Director-ATS/10064,  Seattle
Product Director - Product Platforms, https://www.indeed.jobs/career/JobDetail/Product-Director-Product-Platforms/8811,  Seattle
Product Manager, https://www.indeed.jobs/career/JobDetail/Product-Manager/8677,  Seattle
Product Scientist, https://www.indeed.jobs/career/JobDetail/Product-Scientist/8044,  Seattle
Senior Data Scientist, https://www.indeed.jobs/career/JobDetail/Senior-Data-Scientist/10449,  Seattle
Senior Java Engineer - Remote - Remote, https://www.indeed.jobs/career/JobDetail/Senior-Java-Engineer-Remote/10224,  US
Senior Product Manager, https://www.indeed.jobs/career/JobDetail/Senior-Product-Manager/8678,  Seattle
Senior React/JS Engineer - Remote - Remote, https://www.indeed.jobs/career/JobDetail/Senior-React-JS-Engineer-Remote/10414,  US
Senior Ruby on Rails Engineer - Remote - Remote, https://www.indeed.jobs/career/JobDetail/Senior-Ruby-on-Rails-Engineer-Remote/9412,  US
Senior Software Engineer, https://www.indeed.jobs/career/JobDetail/Senior-Software-Engineer/6263,  Seattle
Senior Software Engineer - Geolocation, https://www.indeed.jobs/career/JobDetail/Senior-Software-Engineer-Geolocation/10431,  Seattle
Senior UI Designer, https://www.indeed.jobs/career/JobDetail/Senior-UI-Designer/10663,  Seattle
APAC Manager  Learning Experience Facilitation, https://www.indeed.jobs/career/JobDetail/APAC-Manager-Learning-Experience-Facilitation/9564,  Tokyo Tech Ebisu
Bilingual - Recruiter, https://www.indeed.jobs/career/JobDetail/Bilingual-Recruiter/7015,  Tokyo Sales/CS
Bilingual Accounts Payable specialist (経理担当), https://www.indeed.jobs/career/JobDetail/Bilingual-Accounts-Payable-specialist-/7874,  Tokyo Sales/CS
Bilingual Client Success Specialist - Japanese and English, https://www.indeed.jobs/career/JobDetail/Bilingual-Client-Success-Specialist-Japanese-and-English/7266,  Tokyo Sales/CS
Bilingual Sales Support Analyst, https://www.indeed.jobs/career/JobDetail/Bilingual-Sales-Support-Analyst/9250,  Tokyo Sales/CS
Business Intelligence Developer, https://www.indeed.jobs/career/JobDetail/Business-Intelligence-Developer/5716,  Tokyo Tech Ebisu
Content Acquisition Senior Manager, https://www.indeed.jobs/career/JobDetail/Content-Acquisition-Senior-Manager/11237,  Tokyo Sales/CS
Content Localization Specialist, https://www.indeed.jobs/career/JobDetail/Content-Localization-Specialist/11415,  Tokyo Tech Ebisu
Content Strategist, https://www.indeed.jobs/career/JobDetail/Content-Strategist/8011,  Tokyo Tech Ebisu
Data Scientist, https://www.indeed.jobs/career/JobDetail/Data-Scientist/6420,  Tokyo Tech Ebisu
Engineering Manager, https://www.indeed.jobs/career/JobDetail/Engineering-Manager/6841,  Tokyo Tech Ebisu
Engineering Manager - Search, https://www.indeed.jobs/career/JobDetail/Engineering-Manager-Search/9702,  Tokyo Tech Ebisu
Front-end Engineering Manager, https://www.indeed.jobs/career/JobDetail/Front-end-Engineering-Manager/9816,  Tokyo Tech Ebisu
Full-Stack Software Engineer, https://www.indeed.jobs/career/JobDetail/Full-Stack-Software-Engineer/6840,  Tokyo Tech Ebisu
HR Business Partner, https://www.indeed.jobs/career/JobDetail/HR-Business-Partner/10370,  Tokyo Sales/CS
HR Coordinator, https://www.indeed.jobs/career/JobDetail/HR-Coordinator/10371,  Tokyo Sales/CS
International Search Quality Operations Analyst, https://www.indeed.jobs/career/JobDetail/International-Search-Quality-Operations-Analyst/10894,  Tokyo Tech Ebisu
IT Compliance Analyst, https://www.indeed.jobs/career/JobDetail/IT-Compliance-Analyst/6821,  Tokyo Tech Ebisu
IT Support Specialist, https://www.indeed.jobs/career/JobDetail/IT-Support-Specialist/10594,  Tokyo Tech Meguro
IT Support Specialist, https://www.indeed.jobs/career/JobDetail/IT-Support-Specialist/10595,  Tokyo Tech Ebisu
Business Development Executive - Job Boards, https://www.indeed.jobs/career/JobDetail/Business-Development-Executive-Job-Boards/10022,  Singapore
Client Success Specialist, https://www.indeed.jobs/career/JobDetail/Client-Success-Specialist/11300,  Singapore
Data Science Manager, https://www.indeed.jobs/career/JobDetail/Data-Science-Manager/11373,  Singapore
Employer Branding Program Manager, https://www.indeed.jobs/career/JobDetail/Employer-Branding-Program-Manager/11181,  Singapore
Engineering Manager, https://www.indeed.jobs/career/JobDetail/Engineering-Manager/7542,  Singapore
Full-Stack Software Engineer, https://www.indeed.jobs/career/JobDetail/Full-Stack-Software-Engineer/7543,  Singapore
International Operations Analyst - Malaysia Market, https://www.indeed.jobs/career/JobDetail/International-Operations-Analyst-Malaysia-Market/7712,  Singapore
Product Manager, https://www.indeed.jobs/career/JobDetail/Product-Manager/10230,  Singapore
Quality Assurance Automation Engineer, https://www.indeed.jobs/career/JobDetail/Quality-Assurance-Automation-Engineer/7834,  Singapore
Quality Assurance Engineer, https://www.indeed.jobs/career/JobDetail/Quality-Assurance-Engineer/7743,  Singapore
Senior International Operations Analyst - Indonesia Market, https://www.indeed.jobs/career/JobDetail/Senior-International-Operations-Analyst-Indonesia-Market/7714,  Singapore
Technical Recruiter, https://www.indeed.jobs/career/JobDetail/Technical-Recruiter/7001,  Singapore
Account Executive, https://www.indeed.jobs/career/JobDetail/Account-Executive/10598,  London
Account Manager, https://www.indeed.jobs/career/JobDetail/Account-Manager/10795,  London
Director of Marketing  UK, https://www.indeed.jobs/career/JobDetail/Director-of-Marketing-UK/11358,  London
Enterprise Sales Manager, https://www.indeed.jobs/career/JobDetail/Enterprise-Sales-Manager/10331,  London
National Account Manager, https://www.indeed.jobs/career/JobDetail/National-Account-Manager/6156,  London
National Account Manager- Agency, https://www.indeed.jobs/career/JobDetail/National-Account-Manager-Agency/8761,  London
Recruiter, https://www.indeed.jobs/career/JobDetail/Recruiter/9689,  London
Senior Client Success Specialist  NA/Ag, https://www.indeed.jobs/career/JobDetail/Senior-Client-Success-Specialist-NA-Ag/11010,  London
Inside Sales Executive, https://www.indeed.jobs/career/JobDetail/Inside-Sales-Executive/11075,  Bangalore
International Strategy & Operations Associate, https://www.indeed.jobs/career/JobDetail/International-Strategy-Operations-Associate/8310,  Bangalore
National Account Manager, https://www.indeed.jobs/career/JobDetail/National-Account-Manager/6836,  Bangalore
Receptionist (Office Coordinator), https://www.indeed.jobs/career/JobDetail/Receptionist-Office-Coordinator-/10876,  Bangalore
Sales Support Specialist, https://www.indeed.jobs/career/JobDetail/Sales-Support-Specialist/10875,  Bangalore
Strategist, https://www.indeed.jobs/career/JobDetail/Strategist/10877,  Bangalore
Android Engineer, https://www.indeed.jobs/career/JobDetail/Android-Engineer/5511,  San Francisco
Digital Marketing Manager  Job Alerts, https://www.indeed.jobs/career/JobDetail/Digital-Marketing-Manager-Job-Alerts/11166,  San Francisco
Director  Engineering - Mobile App, https://www.indeed.jobs/career/JobDetail/Director-Engineering-Mobile-App/10974,  San Francisco
International Sales Manager, https://www.indeed.jobs/career/JobDetail/International-Sales-Manager/10990,  San Francisco
iOS Engineer, https://www.indeed.jobs/career/JobDetail/iOS-Engineer/11009,  San Francisco
Java Manager - Remote - Remote, https://www.indeed.jobs/career/JobDetail/Java-Manager-Remote/10199,  US
Manager  Software Engineering, https://www.indeed.jobs/career/JobDetail/Manager-Software-Engineering/6264,  San Francisco
Product Manager, https://www.indeed.jobs/career/JobDetail/Product-Manager/8681,  San Francisco
Product Science Leader, https://www.indeed.jobs/career/JobDetail/Product-Science-Leader/8178,  San Francisco
Program Manager  Job Seeker, https://www.indeed.jobs/career/JobDetail/Program-Manager-Job-Seeker/8723,  San Francisco
Quality Assurance Automation Engineer, https://www.indeed.jobs/career/JobDetail/Quality-Assurance-Automation-Engineer/7667,  San Francisco
Quality Assurance Manager, https://www.indeed.jobs/career/JobDetail/Quality-Assurance-Manager/7813,  San Francisco
Quantitative UX Researcher, https://www.indeed.jobs/career/JobDetail/Quantitative-UX-Researcher/7929,  San Francisco
Recruitment Evangelist  West (Majors Team), https://www.indeed.jobs/career/JobDetail/Recruitment-Evangelist-West-Majors-Team-/11262,  San Francisco
Senior Java Engineer - Remote - Remote, https://www.indeed.jobs/career/JobDetail/Senior-Java-Engineer-Remote/10224,  US
Senior Product Manager, https://www.indeed.jobs/career/JobDetail/Senior-Product-Manager/8682,  San Francisco
Senior React/JS Engineer - Remote - Remote, https://www.indeed.jobs/career/JobDetail/Senior-React-JS-Engineer-Remote/10414,  US
Senior Ruby on Rails Engineer - Remote - Remote, https://www.indeed.jobs/career/JobDetail/Senior-Ruby-on-Rails-Engineer-Remote/9412,  US
Senior Software Engineer, https://www.indeed.jobs/career/JobDetail/Senior-Software-Engineer/6262,  San Francisco
Senior Software Engineer - Job Spotter, https://www.indeed.jobs/career/JobDetail/Senior-Software-Engineer-Job-Spotter/9674,  San Francisco
Manager  Sales Support Analysts, https://www.indeed.jobs/career/JobDetail/Manager-Sales-Support-Analysts/10766,  New York City
Marketing Manager  DCA, https://www.indeed.jobs/career/JobDetail/Marketing-Manager-DCA/10609,  New York City
National Account Manager - Staffing, https://www.indeed.jobs/career/JobDetail/National-Account-Manager-Staffing/11154,  New York City
Real Estate Financial Analyst, https://www.indeed.jobs/career/JobDetail/Real-Estate-Financial-Analyst/10176,  New York City
Real Estate IT Project Manager, https://www.indeed.jobs/career/JobDetail/Real-Estate-IT-Project-Manager/10433,  New York City
Real Estate IT Project Manager Lead, https://www.indeed.jobs/career/JobDetail/Real-Estate-IT-Project-Manager-Lead/10432,  New York City
Recruitment Evangelist  NYC Metro, https://www.indeed.jobs/career/JobDetail/Recruitment-Evangelist-NYC-Metro/10246,  New York City
Sales Strategist, https://www.indeed.jobs/career/JobDetail/Sales-Strategist/9994,  New York City
Sales Support Analyst, https://www.indeed.jobs/career/JobDetail/Sales-Support-Analyst/10988,  New York City
Sales Support Strategist, https://www.indeed.jobs/career/JobDetail/Sales-Support-Strategist/10494,  New York City
Sales Trainer, https://www.indeed.jobs/career/JobDetail/Sales-Trainer/10844,  New York City
Senior Client Success Specialist  Enterprise Strategy, https://www.indeed.jobs/career/JobDetail/Senior-Client-Success-Specialist-Enterprise-Strategy/10505,  New York City
Senior Client Success Specialist  National Accounts, https://www.indeed.jobs/career/JobDetail/Senior-Client-Success-Specialist-National-Accounts/10801,  New York City
Senior Java Engineer - Remote - Remote, https://www.indeed.jobs/career/JobDetail/Senior-Java-Engineer-Remote/10224,  US
Senior React/JS Engineer - Remote - Remote, https://www.indeed.jobs/career/JobDetail/Senior-React-JS-Engineer-Remote/10414,  US
Senior Ruby on Rails Engineer - Remote - Remote, https://www.indeed.jobs/career/JobDetail/Senior-Ruby-on-Rails-Engineer-Remote/9412,  US
Senior Sales Analyst, https://www.indeed.jobs/career/JobDetail/Senior-Sales-Analyst/10402,  New York City
Software Engineer Content Developer - Remote - Remote, https://www.indeed.jobs/career/JobDetail/Software-Engineer-Content-Developer-Remote/8171,  US
Client Success Specialist - Austin, https://www.indeed.jobs/career/JobDetail/Client-Success-Specialist/6251,  Downtown
Content Acquisition Lead  LATAM - BPO Management, https://www.indeed.jobs/career/JobDetail/Content-Acquisition-Lead-LATAM-BPO-Management/11322,  Austin
