Marketing Manager  Jobseeker Experience, https://www.indeed.jobs/career/JobDetail/Marketing-Manager-Jobseeker-Experience/9141,  Austin
Marketing Manager  SMB Experience, https://www.indeed.jobs/career/JobDetail/Marketing-Manager-SMB-Experience/10809,  Austin
Marketing Research Manager  NPS, https://www.indeed.jobs/career/JobDetail/Marketing-Research-Manager-NPS/11320,  Austin
Natural Language Processing Software Engineer - Search, https://www.indeed.jobs/career/JobDetail/Natural-Language-Processing-Software-Engineer-Search/7865,  Austin
Network Engineer, https://www.indeed.jobs/career/JobDetail/Network-Engineer/10805,  Austin
Network Engineering Manager, https://www.indeed.jobs/career/JobDetail/Network-Engineering-Manager/9932,  Austin
Telecom Specialist, https://www.indeed.jobs/career/JobDetail/Telecom-Specialist/10283,  Dublin
Tradeshow Manager  Global Events, https://www.indeed.jobs/career/JobDetail/Tradeshow-Manager-Global-Events/10599,  Dublin
VP Country Marketing Strategy, https://www.indeed.jobs/career/JobDetail/VP-Country-Marketing-Strategy/9944,  Dublin
Workplace Strategist, https://www.indeed.jobs/career/JobDetail/Workplace-Strategist/10897,  Dublin
New Product Sales Specialist-Labs, https://www.indeed.jobs/career/JobDetail/New-Product-Sales-Specialist-Labs/10816,  Austin
Ontologist, https://www.indeed.jobs/career/JobDetail/Ontologist/9190,  Austin
Operations Manager - Search Quality Data and Measurement, https://www.indeed.jobs/career/JobDetail/Operations-Manager-Search-Quality-Data-and-Measurement/9138,  Austin
Partner Operations Analyst, https://www.indeed.jobs/career/JobDetail/Partner-Operations-Analyst/11130,  Austin
Procurement Contracts Specialist, https://www.indeed.jobs/career/JobDetail/Procurement-Contracts-Specialist/10717,  Austin
Producer  Global Product Marketing, https://www.indeed.jobs/career/JobDetail/Producer-Global-Product-Marketing/9718,  Austin
Product Director - Getting Jobs, https://www.indeed.jobs/career/JobDetail/Product-Director-Getting-Jobs/10065,  Austin
Product Manager, https://www.indeed.jobs/career/JobDetail/Product-Manager/8673,  Austin
Product Manager  Business Automation, https://www.indeed.jobs/career/JobDetail/Product-Manager-Business-Automation/8674,  Austin
Program Manager - Assessments, https://www.indeed.jobs/career/JobDetail/Program-Manager-Assessments/9630,  Austin
Program Manager  Incubator, https://www.indeed.jobs/career/JobDetail/Program-Manager-Incubator/9594,  Austin
Program Manager  Legal, https://www.indeed.jobs/career/JobDetail/Program-Manager-Legal/9827,  Austin
QA Automation Engineer, https://www.indeed.jobs/career/JobDetail/QA-Automation-Engineer/7971,  Austin
Quality Assurance Manager, https://www.indeed.jobs/career/JobDetail/Quality-Assurance-Manager/7812,  Austin
Real Estate Construction Manager, https://www.indeed.jobs/career/JobDetail/Real-Estate-Construction-Manager/8913,  Austin
Recruitment Evangelist  Central (Majors Team), https://www.indeed.jobs/career/JobDetail/Recruitment-Evangelist-Central-Majors-Team-/11260,  Austin
Salesforce Developer, https://www.indeed.jobs/career/JobDetail/Salesforce-Developer/9521,  Austin
Salesforce Success Manager, https://www.indeed.jobs/career/JobDetail/Salesforce-Success-Manager/10989,  Austin
Scaled Operations Team Lead, https://www.indeed.jobs/career/JobDetail/Scaled-Operations-Team-Lead/10360,  Austin
Search Quality Risk and Fraud Analyst, https://www.indeed.jobs/career/JobDetail/Search-Quality-Risk-and-Fraud-Analyst/8406,  Austin
Search Quality Visibility Analyst, https://www.indeed.jobs/career/JobDetail/Search-Quality-Visibility-Analyst/8862,  Austin
Security Engineer, https://www.indeed.jobs/career/JobDetail/Security-Engineer/9111,  Austin
Security Engineering Manager, https://www.indeed.jobs/career/JobDetail/Security-Engineering-Manager/9356,  Austin
Senior Client Success Specialist  National Accounts - Austin, https://www.indeed.jobs/career/JobDetail/Senior-Client-Success-Specialist-National-Accounts/10403,  Downtown
Senior Creative Lead, https://www.indeed.jobs/career/JobDetail/Senior-Creative-Lead/11035,  Austin
Senior CRM Analyst (Salesforce), https://www.indeed.jobs/career/JobDetail/Senior-CRM-Analyst-Salesforce-/10977,  Austin
Senior Director  Global Brand Strategy & Insights, https://www.indeed.jobs/career/JobDetail/Senior-Director-Global-Brand-Strategy-Insights/11183,  Austin
Senior Financial Modeling Analyst  FP&A, https://www.indeed.jobs/career/JobDetail/Senior-Financial-Modeling-Analyst-FP-A/10967,  Austin
Senior Java Engineer - Remote - Remote, https://www.indeed.jobs/career/JobDetail/Senior-Java-Engineer-Remote/10224,  US
Senior Manager  Product Marketing, https://www.indeed.jobs/career/JobDetail/Senior-Manager-Product-Marketing/9709,  Austin
Senior Manager  Technology Services, https://www.indeed.jobs/career/JobDetail/Senior-Manager-Technology-Services/9842,  Austin
Senior React/JS Engineer - Remote - Remote, https://www.indeed.jobs/career/JobDetail/Senior-React-JS-Engineer-Remote/10414,  US
Senior Ruby on Rails Engineer - Remote - Remote, https://www.indeed.jobs/career/JobDetail/Senior-Ruby-on-Rails-Engineer-Remote/9412,  US
Senior Sales and Use Tax Analyst, https://www.indeed.jobs/career/JobDetail/Senior-Sales-and-Use-Tax-Analyst/11323,  Austin
Senior Software Engineer, https://www.indeed.jobs/career/JobDetail/Senior-Software-Engineer/6167,  Austin
Senior Software Engineer - Backend (SMB), https://www.indeed.jobs/career/JobDetail/Senior-Software-Engineer-Backend-SMB-/820,  Austin
Senior Software Engineer - Financial Systems, https://www.indeed.jobs/career/JobDetail/Senior-Software-Engineer-Financial-Systems/10222,  Austin
Senior Software Engineer - Platform Engineer (SMB), https://www.indeed.jobs/career/JobDetail/Senior-Software-Engineer-Platform-Engineer-SMB-/980,  Austin
Senior Taxonomy Analyst, https://www.indeed.jobs/career/JobDetail/Senior-Taxonomy-Analyst/6827,  Austin
Senior UX Designer - Assessments, https://www.indeed.jobs/career/JobDetail/Senior-UX-Designer-Assessments/8141,  Austin
Senior UX Researcher, https://www.indeed.jobs/career/JobDetail/Senior-UX-Researcher/7841,  Austin
Senior Voice of Customer Specialist, https://www.indeed.jobs/career/JobDetail/Senior-Voice-of-Customer-Specialist/10520,  Austin
Software Engineer - Infrastructure and Tools, https://www.indeed.jobs/career/JobDetail/Software-Engineer-Infrastructure-and-Tools/9716,  Austin
Software Engineer Content Developer - Remote - Remote, https://www.indeed.jobs/career/JobDetail/Software-Engineer-Content-Developer-Remote/8171,  US
Software Engineer  Site Reliability Engineer, https://www.indeed.jobs/career/JobDetail/Software-Engineer-Site-Reliability-Engineer/6174,  Austin
Software Engineering Manager, https://www.indeed.jobs/career/JobDetail/Software-Engineering-Manager/6240,  Austin
Sourcer, https://www.indeed.jobs/career/JobDetail/Sourcer/9262,  Austin
Sr Application Security Engineer, https://www.indeed.jobs/career/JobDetail/Sr-Application-Security-Engineer/5362,  Austin
Sr. Diversity Sourcer, https://www.indeed.jobs/career/JobDetail/Sr-Diversity-Sourcer/9281,  Austin
Sr. UX Designer  Search Experience, https://www.indeed.jobs/career/JobDetail/Sr-UX-Designer-Search-Experience/10144,  Austin
Strategy Analyst, https://www.indeed.jobs/career/JobDetail/Strategy-Analyst/11367,  Austin
Strategy Analyst Search Quality Operations, https://www.indeed.jobs/career/JobDetail/Strategy-Analyst-Search-Quality-Operations/9833,  Austin
Subpoenas / Employment Counsel, https://www.indeed.jobs/career/JobDetail/Subpoenas-Employment-Counsel/11119,  Austin
TA Operations Program Specialist - Austin, https://www.indeed.jobs/career/JobDetail/TA-Operations-Program-Specialist/11122,  Downtown
Technical Product Manager, https://www.indeed.jobs/career/JobDetail/Technical-Product-Manager/8675,  Austin
Technical Program Manager, https://www.indeed.jobs/career/JobDetail/Technical-Program-Manager/10583,  Austin
Technical Sourcer, https://www.indeed.jobs/career/JobDetail/Technical-Sourcer/6984,  Austin
Technical Writer, https://www.indeed.jobs/career/JobDetail/Technical-Writer/11092,  Austin
Travel Coordinator, https://www.indeed.jobs/career/JobDetail/Travel-Coordinator/11397,  Austin
UX Designer, https://www.indeed.jobs/career/JobDetail/UX-Designer/8869,  Austin
UX Designer - Internal Tools, https://www.indeed.jobs/career/JobDetail/UX-Designer-Internal-Tools/8722,  Austin
UX Designer  Employer, https://www.indeed.jobs/career/JobDetail/UX-Designer-Employer/9909,  Austin
UX Research Operations Manager, https://www.indeed.jobs/career/JobDetail/UX-Research-Operations-Manager/10238,  Austin
UX Researcher - Assessments, https://www.indeed.jobs/career/JobDetail/UX-Researcher-Assessments/9679,  Austin
VP of Experience, https://www.indeed.jobs/career/JobDetail/VP-of-Experience/10066,  Austin
Web Producer  Wordpress, https://www.indeed.jobs/career/JobDetail/Web-Producer-Wordpress/11211,  Austin
Workday Integrations Developer, https://www.indeed.jobs/career/JobDetail/Workday-Integrations-Developer/10942,  Austin
Workday Security Lead, https://www.indeed.jobs/career/JobDetail/Workday-Security-Lead/10254,  Austin
